{
  "$schema": "https://json-schema.org/draft/2020-12/schema",
  "$id": "https://github.com/EffortlessMetrics/perl-lsp/.ci/receipts/schemas/common-gate-receipt.schema.json",
  "title": "Common Gate Receipt",
  "type": "object",
  "required": ["check", "schema_version", "event", "verdict"],
  "properties": {
    "check": { "type": "string" },
    "schema_version": { "type": "string" },
    "event": {
      "type": "string",
      "enum": ["pull_request", "merge_group", "push", "local"]
    },
    "verdict": {
      "type": "string",
      "enum": ["pass", "fail", "warn", "skipped"]
    },
    "run_id": { "type": ["string", "integer"] },
    "pr": { "type": "integer", "minimum": 1 },
    "base_sha": { "type": "string" },
    "head_sha": { "type": "string" },
    "candidate_sha": { "type": "string" },
    "selected": { "type": "boolean" },
    "selection_reason": { "type": "string" },
    "classification": {
      "type": "string",
      "enum": [
        "code_regression",
        "infra_failure",
        "stale_base",
        "master_red",
        "skipped",
        "unknown"
      ]
    },
    "violations": { "type": "array", "items": { "type": "object" } },
    "metrics": { "type": "object" },
    "artifacts": { "type": "array", "items": { "type": "object" } },
    "repro": {
      "type": "object",
      "properties": {
        "command": { "type": "string" }
      },
      "additionalProperties": true
    },
    "runner": { "type": "object" }
  },
  "additionalProperties": true
}
